{
  "schema_version": "0.1.0",
  "artifact_type": "checksum-ledger",
  "checksum_ledger_id": "checksum-ledger-20260314-demo-0001",
  "run_id": "run-20260314-demo-0001",
  "project": "server-market-deterministic-agentic-model",
  "entries": [
    {
      "artifact_id": "artifact-market-segment-demo-0001",
      "artifact_path": "outputs/demo/market-segment-demo-v0.1.0.md",
      "artifact_type": "market-segment",
      "checksum_algorithm": "sha256",
      "checksum_value": "0123456789abcdef0123456789abcdef0123456789abcdef0123456789abcdef",
      "generated_at": "2026-03-14T12:00:00Z",
      "generated_by": "chatgpt-plus",
      "notes": "Minimal example checksum entry."
    }
  ],
  "notes": "Example checksum ledger.",
  "review_state": "not_reviewed",
  "unresolved_items": []
}
